{
  "$schema": "https://repopilot.dev/schemas/eval-task.schema.json",
  "id": "testwork-refund-boundary-01",
  "repositorySlug": "sample-dotnet-api",
  "category": "test_work",
  "description": "The refund window's boundary behaviour is written down but untested. Nothing covers the last day inside the window or the first day outside it, which is the pair most likely to regress. Add test coverage for the boundary. The behaviour itself is correct and must not change.",
  "relevantFiles": [
    "src/Orders/RefundPolicy.cs",
    "tests/Orders.Tests/RefundPolicyTests.cs"
  ],
  "baselineTestCommand": "unit-refund-policy",
  "successTestCommand": "unit-refund-policy",
  "successCondition": {
    "type": "output_matches",
    "pattern": "Failed:\\s+0,\\s+Passed:\\s+(?:[3-9]|\\d{2,}),"
  },
  "expectedChangedFiles": [
    "tests/Orders.Tests/RefundPolicyTests.cs"
  ],
  "referencePatch": "_reference/testwork-refund-boundary-01.md"
}
