{
  "$schema": "https://repopilot.dev/schemas/eval-task.schema.json",
  "id": "testwork-dunning-coverage-03",
  "repositorySlug": "sample-dotnet-billing",
  "category": "test_work",
  "description": "The later stages of the overdue-invoice schedule are untested. Nothing covers the day a final notice becomes due or the day an account is suspended, which are the two boundaries the collections team actually argues about. Add test coverage for them. The behaviour itself is correct and must not change.",
  "relevantFiles": [
    "src/Billing/DunningSchedule.cs",
    "tests/Billing.Tests/DunningScheduleTests.cs"
  ],
  "baselineTestCommand": "unit-dunning",
  "successTestCommand": "unit-dunning",
  "successCondition": {
    "type": "output_matches",
    "pattern": "Failed:\\s+0,\\s+Passed:\\s+(?:[3-9]|\\d{2,}),"
  },
  "expectedChangedFiles": [
    "tests/Billing.Tests/DunningScheduleTests.cs"
  ],
  "referencePatch": "_reference/testwork-dunning-coverage-03.md"
}
